{
  "name": "Books library",
  "version": "85",
  "parameters": [ 
  	{ 
  	  "id": "books.frequency",
  	  "name": "frequency",
  	  "type": "double",
  	  "default": "0.1"
  	},
  	{
  	  "id": "books.type",
  	  "name": "type",
  	  "type": "string",
  	  "values": ["historic", "romance", "sci-fi"],
  	  "default": "sci-fi"
  	}
  ],
  "interfaces": [
    {
      "name": "books XSD",
      "autoConnect": false,
      "allowMultiple": false,
      "interfaceVersions": [
        {
          "versionName": "8.5 XSD",
          "type": "xsd",
          "location": "books.xsd",
          "sends": ["BooksForm"],
          "receives": ["BooksForm"]
        },
        {
          "versionName": "readonly",
          "type": "xsd",
          "location": "books.xsd",
          "sends": [],
          "receives": ["BooksForm"]
        }
      ]
    }
  ]
}
